{
  "meta": {
    "type": "study-roadmap",
    "subject": "xingce",
    "version": "v1.0",
    "updatedAt": "2026-05-26",
    "contentKind": "curated-library"
  },
  "title": "行政职业能力测验系统训练手册",
  "description": "围绕政治理论、常识判断、言语理解与表达、数量关系、判断推理、资料分析六大官方测查板块，建立知识补足、方法训练、速度控制和错题复盘体系。",
  "basisNote": "依据国家公务员局来源的 2026 年度国考公共科目笔试考试大纲整理。大纲明确行政职业能力测验为客观性试题，考试时限 120 分钟、满分 100 分；作答须以实际试卷及报考类别为准。",
  "examProfile": {
    "syllabusTitle": "中央机关及其直属机构2026年度考试录用公务员公共科目笔试考试大纲",
    "syllabusDate": "2025-10-16",
    "syllabusUrl": "https://www.forestry.gov.cn/c/www/gsgg/645383.jhtml",
    "durationMinutes": 120,
    "score": 100,
    "questionNature": "客观性试题",
    "officialModules": [
      "政治理论",
      "常识判断",
      "言语理解与表达",
      "数量关系",
      "判断推理",
      "资料分析"
    ],
    "notice": "官方大纲列示的题型介绍为通用说明，试卷结构、题量与题目分布以当次考试题本为准。"
  },
  "stages": [
    {
      "id": "x-stage-1",
      "title": "阶段一：摸底与时间感建立",
      "duration": "2-3 天",
      "goal": "通过一套真题识别正确率、耗时和模块短板。",
      "tasks": [
        "按照正式时间完成一套对应类别真题，不中断查资料。",
        "记录每个模块题量、正确率、平均耗时和蒙题数量。",
        "将错题归因为不会、误读、计算慢、推理错或时间不足。"
      ],
      "outputs": [
        "摸底成绩表",
        "模块优先级清单"
      ],
      "milestone": "明确需要主攻的两个模块与可以稳定保分的模块。"
    },
    {
      "id": "x-stage-2",
      "title": "阶段二：言语与判断基础方法",
      "duration": "7-10 天",
      "goal": "掌握高频题型的识别信号和快速排除路径。",
      "tasks": [
        "训练主旨意图、逻辑填空、语句排序与衔接。",
        "训练图形、定义、类比、逻辑判断基础题型。",
        "错题必须回写为何误选及正确选项的依据。"
      ],
      "outputs": [
        "言语关键词卡",
        "判断推理规则表"
      ],
      "milestone": "中等难度题可按固定步骤完成，不凭感觉选项。"
    },
    {
      "id": "x-stage-3",
      "title": "阶段三：数量与资料速算",
      "duration": "10-14 天",
      "goal": "建立常见模型和估算意识，在可控时间内提高资料得分。",
      "tasks": [
        "训练工程、行程、比例、排列组合与概率等常见数量模型。",
        "掌握增长率、比重、平均数、倍数及基期现期关系。",
        "每日限时做一组资料分析，记录计算策略和耗时。"
      ],
      "outputs": [
        "公式与模型卡",
        "资料分析限时记录"
      ],
      "milestone": "资料分析能先列式再估算，减少无效精算。"
    },
    {
      "id": "x-stage-4",
      "title": "阶段四：政治理论与常识积累",
      "duration": "全程滚动",
      "goal": "以权威来源维护稳定、可更新的基础知识和时政联系。",
      "tasks": [
        "围绕党的创新理论、国家方针政策、法治和历史文化建立笔记。",
        "结合每日时政内容记录高频政策词与基本事实。",
        "每周完成常识错题回顾，只积累可核验知识点。"
      ],
      "outputs": [
        "政治理论要点索引",
        "常识与时政错题册"
      ],
      "milestone": "不会将模糊印象当作结论，能够回溯来源。"
    },
    {
      "id": "x-stage-5",
      "title": "阶段五：模块套题与策略排序",
      "duration": "7-10 天",
      "goal": "形成适合自己的答题顺序、放弃策略与涂卡节奏。",
      "tasks": [
        "按模块限时训练并比较不同作答顺序的得分效率。",
        "识别高耗低效题，设定暂跳与回看原则。",
        "练习分段涂卡和时间节点提醒。"
      ],
      "outputs": [
        "个人作答顺序",
        "模块时间预算表"
      ],
      "milestone": "能在总时限内完成全部可得分题并预留涂卡检查时间。"
    },
    {
      "id": "x-stage-6",
      "title": "阶段六：整卷冲刺与复盘",
      "duration": "考前持续",
      "goal": "用真实节奏稳定正确率，针对薄弱模块闭环修正。",
      "tasks": [
        "每周完成至少两套限时真题或高质量模拟题。",
        "复盘只记录可行动原因：题型误判、规则遗忘、计算策略、时间决策。",
        "针对最高频错误追加同类训练并在下一套验证。"
      ],
      "outputs": [
        "整卷趋势记录",
        "高频错误修正表"
      ],
      "milestone": "连续整卷得分与用时趋于稳定，错题原因可控。"
    }
  ],
  "moduleGuides": [
    {
      "id": "politics",
      "title": "政治理论",
      "ability": "考查运用党的创新理论及党和国家方针政策分析、判断、解决问题的能力。",
      "topics": [
        "理论基础",
        "方针政策",
        "重大部署",
        "时政结合"
      ],
      "methods": [
        "以权威文件和正式发布内容建立专题索引，避免凭印象背结论。",
        "学习概念时同步记录适用场景、目标与关键词，提升情境分析能力。",
        "将每日政策新闻关联到理论主题，完成事实与观点的双向复习。"
      ],
      "pitfalls": [
        "只背口号而不了解政策适用情境。",
        "使用来源不清的碎片化记忆替代权威表述。"
      ],
      "drills": [
        "每周整理一页政策主题笔记。",
        "将错题对应到具体概念或政策原文。"
      ]
    },
    {
      "id": "common",
      "title": "常识判断",
      "ability": "测查在政治、经济、法律、历史、文化、地理、环境、自然与科技等方面应知应会的基本知识及分析能力。",
      "topics": [
        "法律基础",
        "经济常识",
        "历史文化",
        "地理科技",
        "生态环境"
      ],
      "methods": [
        "采用专题化积累而非随机刷知识点，建立概念之间的联系。",
        "题目先判断所属学科与考查核心，再排除明显违背常识或规则的选项。",
        "对于政策和法律变化内容，只记录可回溯原始来源的结论。"
      ],
      "pitfalls": [
        "过度纠缠生僻题导致时间失控。",
        "未区分稳定常识和需要更新的时政法规内容。"
      ],
      "drills": [
        "每天定量完成常识题并按专题归档。",
        "对错题补充一句正确依据和来源。"
      ]
    },
    {
      "id": "verbal",
      "title": "言语理解与表达",
      "ability": "测查准确理解文字材料内涵、把握关系、概括主旨、选择恰当表达的能力。",
      "topics": [
        "阅读理解",
        "逻辑填空",
        "语句表达",
        "片段主旨"
      ],
      "methods": [
        "主旨题先找总分结构、转折和结论句，再比对选项覆盖范围。",
        "逻辑填空结合语境、搭配和感情色彩，不单凭熟悉感选择。",
        "排序与衔接先找指代、关联词、时间逻辑和话题一致性。"
      ],
      "pitfalls": [
        "选项表述正确但不是文段重点。",
        "纠结局部词语而忽略整体逻辑。"
      ],
      "drills": [
        "将每道错题标为主旨误判、语境误判或选项比较失误。",
        "限时完成小组训练，培养读干信息和快速排除能力。"
      ]
    },
    {
      "id": "quantity",
      "title": "数量关系",
      "ability": "测查理解和把握事物间量化关系、解决数量关系问题的能力。",
      "topics": [
        "数据关系分析",
        "运算",
        "工程行程",
        "排列概率",
        "方程比例"
      ],
      "methods": [
        "先识别模型再列式，优先使用特值、比例、方程或枚举等适合方法。",
        "训练估算与选项代入，避免每题都进行繁琐精算。",
        "建立暂跳策略，高耗时难题不影响可得分模块。"
      ],
      "pitfalls": [
        "看见数字就盲目计算，未识别题型模型。",
        "一道难题投入过多时间，挤占资料分析时间。"
      ],
      "drills": [
        "按模型集中训练并记录最快方法。",
        "每组训练严格计时，超过阈值题目标记为策略题。"
      ]
    },
    {
      "id": "reasoning",
      "title": "判断推理",
      "ability": "测查对图形、语词概念、事物关系和文字材料进行分析推理的能力。",
      "topics": [
        "图形推理",
        "定义判断",
        "类比推理",
        "逻辑判断"
      ],
      "methods": [
        "图形按位置、数量、属性、样式、空间等顺序快速试规律。",
        "定义判断先拆主体、条件、行为、结果，再逐项核对案例。",
        "论证题分清加强、削弱、前提与解释，聚焦论点和论据连接。"
      ],
      "pitfalls": [
        "图形题无序尝试规律导致超时。",
        "定义题凭生活经验而不按定义要件判断。",
        "逻辑题混淆论点与背景信息。"
      ],
      "drills": [
        "制作图形规律和逻辑论证错题标签。",
        "写出定义题所缺或符合的关键要件。"
      ]
    },
    {
      "id": "data",
      "title": "资料分析",
      "ability": "测查对文字、数字、图表等统计资料进行综合理解与分析加工的能力。",
      "topics": [
        "增长",
        "比重",
        "平均数",
        "倍数",
        "综合判断"
      ],
      "methods": [
        "先看题目再定位材料，圈定单位、时期和口径，避免读完整篇后遗忘。",
        "列清现期、基期、增长量、增长率与比重关系，结合选项估算。",
        "综合判断优先检查计算简单或表述明显的选项，控制精算题数量。"
      ],
      "pitfalls": [
        "单位、同比环比或累计口径看错。",
        "每题精确计算，速度不足。",
        "列式正确但计算或比较粗心。"
      ],
      "drills": [
        "每天完成一篇限时资料，并记录错因与计算方法。",
        "专项复习常用关系式与速算比较技巧。"
      ]
    }
  ],
  "formulaCards": [
    {
      "title": "增长基础",
      "rules": [
        "增长量 = 现期量 - 基期量。",
        "增长率 = 增长量 / 基期量。",
        "基期量 = 现期量 / (1 + 增长率)。",
        "比较增速时先看口径、单位和时期是否一致。"
      ]
    },
    {
      "title": "比重与平均数",
      "rules": [
        "比重 = 部分量 / 整体量。",
        "平均数 = 总量 / 份数。",
        "部分增速高于整体增速时，比重通常上升；反之下降。",
        "涉及变化判断时先比较分子与分母增速再计算。"
      ]
    },
    {
      "title": "行程与工程",
      "rules": [
        "路程 = 速度 x 时间，优先统一单位。",
        "总工程量可设为工作效率的公倍数，便于计算。",
        "比例关系明显时优先设份数，少用复杂方程。"
      ]
    },
    {
      "title": "答题速度原则",
      "rules": [
        "先拿稳定分，再处理耗时题。",
        "不能在短时间形成解题路径的题目先跳过。",
        "涂卡与检查必须预留时间，不用最后一分钟赌全部转涂。"
      ]
    }
  ],
  "timePlan": [
    {
      "phase": "开场定位",
      "target": "2-3 分钟",
      "method": "确认题量和答题卡要求，按个人策略进入首个优势模块。"
    },
    {
      "phase": "优势模块",
      "target": "优先完成",
      "method": "先稳定获取正确率高、速度快的模块分数，建立节奏。"
    },
    {
      "phase": "资料分析",
      "target": "预留完整时段",
      "method": "资料往往具备训练后较稳定的得分效率，应避免被数量难题挤压。"
    },
    {
      "phase": "数量或难题回看",
      "target": "剩余弹性时间",
      "method": "集中处理已标记、且有把握在较短时间完成的题目。"
    },
    {
      "phase": "涂卡检查",
      "target": "考前模拟后固定",
      "method": "根据个人涂卡习惯保留明确时间，检查题号错位与遗漏。"
    }
  ],
  "practiceChecklist": [
    {
      "title": "每日训练",
      "items": [
        "完成一个主攻模块的限时题组。",
        "复盘错题并写明正确依据和错误原因。",
        "整理一条政治理论或常识的权威来源知识点。"
      ]
    },
    {
      "title": "每周训练",
      "items": [
        "完成至少一套完整限时真题。",
        "统计模块正确率、耗时和放弃题数量变化。",
        "对最高频错因安排下一周专项训练。"
      ]
    },
    {
      "title": "考前冲刺",
      "items": [
        "固定答题顺序与涂卡节奏，不频繁更换策略。",
        "回看错题规律和基础公式，不盲目扩大新题量。",
        "及时核对招考公告和考试要求。"
      ]
    }
  ],
  "suggestions": [
    "先做完整真题摸底，再依据正确率与耗时安排模块训练优先级。",
    "政治理论与常识知识只积累可核验来源，时政内容与题目方法分开记录。",
    "资料分析和言语、判断通常更适合通过持续训练稳定得分；数量关系强调策略取舍。",
    "所有专项训练都应记录用时，行测提升不仅是会做，更是及时做对。",
    "考前以真题和复盘为主，固定答题顺序与涂卡节奏。"
  ],
  "references": [
    {
      "title": "中央机关及其直属机构2026年度考试录用公务员公共科目笔试考试大纲",
      "publisher": "国家公务员局（国家林业和草原局政府网转载）",
      "kind": "官方大纲",
      "url": "https://www.forestry.gov.cn/c/www/gsgg/645383.jhtml",
      "note": "用于行测时限、分值、官方模块分类和能力表述依据。",
      "accessedAt": "2026-05-26"
    }
  ]
}
